{
  "all_controls_pass": true,
  "claim_boundary": "finite deterministic roadmap-engine simulation; not empirical evidence, not a physical qFEP realization, and not evidence for clinical, contemplative, or neural outcomes",
  "controls": {
    "all_negative_controls_fail_safely": true,
    "entropy_production_nonnegative": true,
    "hamiltonian_hermitian": true,
    "positive_semidefinite": true,
    "strongest_rate_entropy_non_decreasing": true,
    "strongest_rate_mutual_information_contracts": true,
    "trace_preserved": true
  },
  "decoherence_rate_grid": [
    0.0,
    0.12,
    0.3,
    0.6
  ],
  "hamiltonian_terms": [
    {
      "coefficient": 0.35,
      "operator": "Z tensor I"
    },
    {
      "coefficient": 0.2,
      "operator": "Z tensor Z"
    }
  ],
  "max_entropy_production_bits": 0.9999995979,
  "max_trace_error": 0.0,
  "min_eigenvalue": 0.0,
  "negative_controls": [
    {
      "id": "non_hermitian_hamiltonian_rejected",
      "passes": true,
      "reason": "Hamiltonian audit rejects non-Hermitian generator input."
    },
    {
      "id": "trace_breaking_density_rejected",
      "passes": true,
      "reason": "Trace-breaking density matrix is detected before propagation."
    },
    {
      "id": "nonpositive_density_rejected",
      "passes": true,
      "reason": "Non-positive density matrix is detected as a negative-control failure."
    }
  ],
  "row_count": 84,
  "rows": [
    {
      "decoherence_rate": 0.0,
      "entropy_production_bits": 0.0,
      "global_entropy_bits": 0.0,
      "hamiltonian_label": "boundary_z_and_zz",
      "min_eigenvalue": 0.0,
      "mutual_information_bits": 2.0,
      "purity": 1.0,
      "reduced_entropy_a_bits": 1.0,
      "reduced_entropy_b_bits": 1.0,
      "state_label": "boundary_bell_state",
      "time": 0.0,
      "trace_imag_abs": 0.0,
      "trace_real": 1.0
    },
    {
      "decoherence_rate": 0.0,
      "entropy_production_bits": 0.0,
      "global_entropy_bits": 0.0,
      "hamiltonian_label": "boundary_z_and_zz",
      "min_eigenvalue": 0.0,
      "mutual_information_bits": 2.0,
      "purity": 1.0,
      "reduced_entropy_a_bits": 1.0,
      "reduced_entropy_b_bits": 1.0,
      "state_label": "boundary_bell_state",
      "time": 0.15,
      "trace_imag_abs": 0.0,
      "trace_real": 1.0
    },
    {
      "decoherence_rate": 0.0,
      "entropy_production_bits": 0.0,
      "global_entropy_bits": 0.0,
      "hamiltonian_label": "boundary_z_and_zz",
      "min_eigenvalue": -0.0,
      "mutual_information_bits": 2.0,
      "purity": 1.0,
      "reduced_entropy_a_bits": 1.0,
      "reduced_entropy_b_bits": 1.0,
      "state_label": "boundary_bell_state",
      "time": 0.3,
      "trace_imag_abs": 0.0,
      "trace_real": 1.0
    },
    {
      "decoherence_rate": 0.0,
      "entropy_production_bits": 0.0,
      "global_entropy_bits": 0.0,
      "hamiltonian_label": "boundary_z_and_zz",
      "min_eigenvalue": -0.0,
      "mutual_information_bits": 2.0,
      "purity": 1.0,
      "reduced_entropy_a_bits": 1.0,
      "reduced_entropy_b_bits": 1.0,
      "state_label": "boundary_bell_state",
      "time": 0.45,
      "trace_imag_abs": 0.0,
      "trace_real": 1.0
    },
    {
      "decoherence_rate": 0.0,
      "entropy_production_bits": 0.0,
      "global_entropy_bits": 0.0,
      "hamiltonian_label": "boundary_z_and_zz",
      "min_eigenvalue": -0.0,
      "mutual_information_bits": 2.0,
      "purity": 1.0,
      "reduced_entropy_a_bits": 1.0,
      "reduced_entropy_b_bits": 1.0,
      "state_label": "boundary_bell_state",
      "time": 0.6,
      "trace_imag_abs": 0.0,
      "trace_real": 1.0
    },
    {
      "decoherence_rate": 0.0,
      "entropy_production_bits": 0.0,
      "global_entropy_bits": 0.0,
      "hamiltonian_label": "boundary_z_and_zz",
      "min_eigenvalue": 0.0,
      "mutual_information_bits": 2.0,
      "purity": 1.0,
      "reduced_entropy_a_bits": 1.0,
      "reduced_entropy_b_bits": 1.0,
      "state_label": "boundary_bell_state",
      "time": 0.75,
      "trace_imag_abs": 0.0,
      "trace_real": 1.0
    },
    {
      "decoherence_rate": 0.0,
      "entropy_production_bits": 0.0,
      "global_entropy_bits": 0.0,
      "hamiltonian_label": "boundary_z_and_zz",
      "min_eigenvalue": 0.0,
      "mutual_information_bits": 2.0,
      "purity": 1.0,
      "reduced_entropy_a_bits": 1.0,
      "reduced_entropy_b_bits": 1.0,
      "state_label": "boundary_bell_state",
      "time": 0.9,
      "trace_imag_abs": 0.0,
      "trace_real": 1.0
    },
    {
      "decoherence_rate": 0.0,
      "entropy_production_bits": 0.0,
      "global_entropy_bits": 0.0,
      "hamiltonian_label": "boundary_z_and_zz",
      "min_eigenvalue": 0.0,
      "mutual_information_bits": 2.0,
      "purity": 1.0,
      "reduced_entropy_a_bits": 1.0,
      "reduced_entropy_b_bits": 1.0,
      "state_label": "boundary_bell_state",
      "time": 1.05,
      "trace_imag_abs": 0.0,
      "trace_real": 1.0
    },
    {
      "decoherence_rate": 0.0,
      "entropy_production_bits": 0.0,
      "global_entropy_bits": 0.0,
      "hamiltonian_label": "boundary_z_and_zz",
      "min_eigenvalue": 0.0,
      "mutual_information_bits": 2.0,
      "purity": 1.0,
      "reduced_entropy_a_bits": 1.0,
      "reduced_entropy_b_bits": 1.0,
      "state_label": "boundary_bell_state",
      "time": 1.2,
      "trace_imag_abs": 0.0,
      "trace_real": 1.0
    },
    {
      "decoherence_rate": 0.0,
      "entropy_production_bits": 0.0,
      "global_entropy_bits": 0.0,
      "hamiltonian_label": "boundary_z_and_zz",
      "min_eigenvalue": 0.0,
      "mutual_information_bits": 2.0,
      "purity": 1.0,
      "reduced_entropy_a_bits": 1.0,
      "reduced_entropy_b_bits": 1.0,
      "state_label": "boundary_bell_state",
      "time": 1.35,
      "trace_imag_abs": 0.0,
      "trace_real": 1.0
    },
    {
      "decoherence_rate": 0.0,
      "entropy_production_bits": 0.0,
      "global_entropy_bits": 0.0,
      "hamiltonian_label": "boundary_z_and_zz",
      "min_eigenvalue": -0.0,
      "mutual_information_bits": 2.0,
      "purity": 1.0,
      "reduced_entropy_a_bits": 1.0,
      "reduced_entropy_b_bits": 1.0,
      "state_label": "boundary_bell_state",
      "time": 1.5,
      "trace_imag_abs": 0.0,
      "trace_real": 1.0
    },
    {
      "decoherence_rate": 0.0,
      "entropy_production_bits": 0.0,
      "global_entropy_bits": 0.0,
      "hamiltonian_label": "boundary_z_and_zz",
      "min_eigenvalue": -0.0,
      "mutual_information_bits": 2.0,
      "purity": 1.0,
      "reduced_entropy_a_bits": 1.0,
      "reduced_entropy_b_bits": 1.0,
      "state_label": "boundary_bell_state",
      "time": 1.65,
      "trace_imag_abs": 0.0,
      "trace_real": 1.0
    },
    {
      "decoherence_rate": 0.0,
      "entropy_production_bits": 0.0,
      "global_entropy_bits": 0.0,
      "hamiltonian_label": "boundary_z_and_zz",
      "min_eigenvalue": -0.0,
      "mutual_information_bits": 2.0,
      "purity": 1.0,
      "reduced_entropy_a_bits": 1.0,
      "reduced_entropy_b_bits": 1.0,
      "state_label": "boundary_bell_state",
      "time": 1.8,
      "trace_imag_abs": 0.0,
      "trace_real": 1.0
    },
    {
      "decoherence_rate": 0.0,
      "entropy_production_bits": 0.0,
      "global_entropy_bits": 0.0,
      "hamiltonian_label": "boundary_z_and_zz",
      "min_eigenvalue": -0.0,
      "mutual_information_bits": 2.0,
      "purity": 1.0,
      "reduced_entropy_a_bits": 1.0,
      "reduced_entropy_b_bits": 1.0,
      "state_label": "boundary_bell_state",
      "time": 1.95,
      "trace_imag_abs": 0.0,
      "trace_real": 1.0
    },
    {
      "decoherence_rate": 0.0,
      "entropy_production_bits": 0.0,
      "global_entropy_bits": 0.0,
      "hamiltonian_label": "boundary_z_and_zz",
      "min_eigenvalue": -0.0,
      "mutual_information_bits": 2.0,
      "purity": 1.0,
      "reduced_entropy_a_bits": 1.0,
      "reduced_entropy_b_bits": 1.0,
      "state_label": "boundary_bell_state",
      "time": 2.1,
      "trace_imag_abs": 0.0,
      "trace_real": 1.0
    },
    {
      "decoherence_rate": 0.0,
      "entropy_production_bits": 0.0,
      "global_entropy_bits": 0.0,
      "hamiltonian_label": "boundary_z_and_zz",
      "min_eigenvalue": -0.0,
      "mutual_information_bits": 2.0,
      "purity": 1.0,
      "reduced_entropy_a_bits": 1.0,
      "reduced_entropy_b_bits": 1.0,
      "state_label": "boundary_bell_state",
      "time": 2.25,
      "trace_imag_abs": 0.0,
      "trace_real": 1.0
    },
    {
      "decoherence_rate": 0.0,
      "entropy_production_bits": 0.0,
      "global_entropy_bits": 0.0,
      "hamiltonian_label": "boundary_z_and_zz",
      "min_eigenvalue": 0.0,
      "mutual_information_bits": 2.0,
      "purity": 1.0,
      "reduced_entropy_a_bits": 1.0,
      "reduced_entropy_b_bits": 1.0,
      "state_label": "boundary_bell_state",
      "time": 2.4,
      "trace_imag_abs": 0.0,
      "trace_real": 1.0
    },
    {
      "decoherence_rate": 0.0,
      "entropy_production_bits": 0.0,
      "global_entropy_bits": 0.0,
      "hamiltonian_label": "boundary_z_and_zz",
      "min_eigenvalue": -0.0,
      "mutual_information_bits": 2.0,
      "purity": 1.0,
      "reduced_entropy_a_bits": 1.0,
      "reduced_entropy_b_bits": 1.0,
      "state_label": "boundary_bell_state",
      "time": 2.55,
      "trace_imag_abs": 0.0,
      "trace_real": 1.0
    },
    {
      "decoherence_rate": 0.0,
      "entropy_production_bits": 0.0,
      "global_entropy_bits": 0.0,
      "hamiltonian_label": "boundary_z_and_zz",
      "min_eigenvalue": 0.0,
      "mutual_information_bits": 2.0,
      "purity": 1.0,
      "reduced_entropy_a_bits": 1.0,
      "reduced_entropy_b_bits": 1.0,
      "state_label": "boundary_bell_state",
      "time": 2.7,
      "trace_imag_abs": 0.0,
      "trace_real": 1.0
    },
    {
      "decoherence_rate": 0.0,
      "entropy_production_bits": 0.0,
      "global_entropy_bits": 0.0,